{
  "schema_version": 1,
  "repository": "golshandvr-del/workbench",
  "repository_id": 1,
  "branch": "work",
  "commit_sha": "bbbbbbbbbbbbbbbbbbbbbbbbbbbbbbbbbbbbbbbb",
  "workflow_file": ".github/workflows/ci.yml",
  "run_id": 501,
  "run_attempt": 1,
  "outcome": "success",
  "artifacts": [
    {
      "artifact_id": 9,
      "name": "app",
      "sha256": "cccccccccccccccccccccccccccccccccccccccccccccccccccccccccccccccc",
      "verification": "matched"
    }
  ]
}